{
  "$schema": "https://json-schema.org/draft/2020-12/schema",
  "$id": "edgecnn/split_meta",
  "title": "Split metadata",
  "description": "SEAM 1. data/splits/split_meta.json - the reproducibility record for the dataset split. Produced by Member 1; read by everyone and quoted directly in the report's Section 1 and reproducibility notes. Committed to git.",
  "type": "object",
  "required": [
    "dataset_name",
    "num_classes",
    "class_names",
    "image_size",
    "seed",
    "stratified",
    "fractions",
    "counts",
    "manifest_sha256",
    "created_utc"
  ],
  "additionalProperties": true,
  "properties": {
    "dataset_name": {
      "type": "string",
      "description": "e.g. 'eurosat'. Matches dataset.name in configs/stages/data.yaml."
    },
    "dataset_source": {
      "type": "string",
      "description": "Where the raw data came from, for the report's citation."
    },
    "num_classes": { "type": "integer", "minimum": 2 },
    "class_names": {
      "type": "array",
      "minItems": 2,
      "uniqueItems": true,
      "items": { "type": "string", "minLength": 1 },
      "description": "FROZEN ordering. class_names[i] is the label for integer class i. Every per-class metric, confusion matrix axis and figure legend is indexed by this array. Re-sorting it invalidates every committed result."
    },
    "image_size": {
      "type": "array",
      "minItems": 2,
      "maxItems": 2,
      "items": { "type": "integer", "minimum": 1, "maximum": 64 },
      "description": "[height, width]. Assignment caps this at 64x64."
    },
    "seed": {
      "type": "integer",
      "description": "RNG seed used to draw the split. Every committed run uses 42."
    },
    "stratified": {
      "type": "boolean",
      "description": "True if class proportions were preserved across splits."
    },
    "fractions": {
      "type": "object",
      "required": ["train", "val", "test"],
      "additionalProperties": false,
      "properties": {
        "train": { "type": "number", "exclusiveMinimum": 0, "exclusiveMaximum": 1 },
        "val": { "type": "number", "exclusiveMinimum": 0, "exclusiveMaximum": 1 },
        "test": { "type": "number", "exclusiveMinimum": 0, "exclusiveMaximum": 1 }
      }
    },
    "counts": {
      "type": "object",
      "required": ["train", "val", "test", "total"],
      "additionalProperties": false,
      "properties": {
        "train": { "type": "integer", "minimum": 1 },
        "val": { "type": "integer", "minimum": 1 },
        "test": { "type": "integer", "minimum": 1 },
        "total": { "type": "integer", "minimum": 3 }
      },
      "description": "Realised image counts per split. Goes straight into the report's Section 1 table."
    },
    "per_class_counts": {
      "type": "object",
      "description": "Optional {split: {class_name: count}}. Useful for discussing class imbalance in the confusion-matrix analysis.",
      "additionalProperties": true
    },
    "manifest_sha256": {
      "type": "string",
      "pattern": "^[0-9a-f]{64}$",
      "description": "SHA-256 of split_manifest.csv. If this does not match the file on disk, someone regenerated or hand-edited the split and every downstream result is stale."
    },
    "created_utc": {
      "type": "string",
      "description": "ISO-8601 UTC timestamp of generation."
    }
  }
}
