{
  "dataset_name": "eurosat",
  "dataset_source": "torchvision.datasets.EuroSAT; Helber et al., \"EuroSAT: A Novel Dataset and Deep Learning Benchmark for Land Use and Land Cover Classification\", IEEE JSTARS, 2019.",
  "num_classes": 10,
  "class_names": [
    "AnnualCrop",
    "Forest",
    "HerbaceousVegetation",
    "Highway",
    "Industrial",
    "Pasture",
    "PermanentCrop",
    "Residential",
    "River",
    "SeaLake"
  ],
  "image_size": [
    64,
    64
  ],
  "seed": 42,
  "stratified": true,
  "fractions": {
    "train": 0.7,
    "val": 0.15,
    "test": 0.15
  },
  "counts": {
    "train": 18900,
    "val": 4050,
    "test": 4050,
    "total": 27000
  },
  "per_class_counts": {
    "train": {
      "AnnualCrop": 2100,
      "Forest": 2100,
      "HerbaceousVegetation": 2100,
      "Highway": 1750,
      "Industrial": 1750,
      "Pasture": 1400,
      "PermanentCrop": 1750,
      "Residential": 2100,
      "River": 1750,
      "SeaLake": 2100
    },
    "val": {
      "AnnualCrop": 450,
      "Forest": 450,
      "HerbaceousVegetation": 450,
      "Highway": 375,
      "Industrial": 375,
      "Pasture": 300,
      "PermanentCrop": 375,
      "Residential": 450,
      "River": 375,
      "SeaLake": 450
    },
    "test": {
      "AnnualCrop": 450,
      "Forest": 450,
      "HerbaceousVegetation": 450,
      "Highway": 375,
      "Industrial": 375,
      "Pasture": 300,
      "PermanentCrop": 375,
      "Residential": 450,
      "River": 375,
      "SeaLake": 450
    }
  },
  "created_utc": "2026-10-01T15:23:20+00:00",
  "manifest_sha256": "9fc7491cc0b8266013ca7f91e4a0988f39464988545251ee1361552823ea162b"
}
